{
  "created_utc": "2026-10-16T23:23:51.269507+00:00",
  "model": {
    "independent_verification": "passed",
    "rational_value_count": 4,
    "unparsed_value_names": [],
    "verification_note": "exact Fraction re-evaluation of all encoded same-period deviations"
  },
  "query": {
    "bytes": 859,
    "claim_scope": "independent profiles; all deterministic deviations with the same period",
    "epsilon": "0",
    "path": "C:\\Users\\scott\\GitHub\\UNIFORM\\artifacts\\solver_smoke\\query.smt2",
    "period": 1,
    "sha256": "bb174c9835403917a9671ed75db1d91316e356ffd02a38a95639c3b133ca45a9"
  },
  "run": {
    "backend": "python-binding",
    "elapsed_seconds": 0.07042619999992894,
    "executable": "python:z3",
    "proof_available": false,
    "returncode": 0,
    "solver": "z3",
    "status": "sat",
    "timed_out": false,
    "version": "5.3.1"
  },
  "schema": "uniform.solver-artifact/v1",
  "trust_boundary": {
    "global_game_claim": false,
    "sat": "candidate until independently checked",
    "unsat": "bounded solver result; native proof is not independently checked here"
  }
}
