{
  "created_utc": "2026-10-16T23:43:45.166152+00:00",
  "model": {
    "independent_verification": "passed",
    "rational_value_count": 5,
    "unparsed_value_names": [],
    "verification_note": "exact Fraction re-evaluation of all deterministic stationary deviations"
  },
  "query": {
    "bytes": 878,
    "claim_scope": "independent stationary profiles; all deterministic stationary deviations",
    "epsilon": "0",
    "game_sha256": "d407f4ccf08fea3634416db1c8da2175755615c14606097f68370c9ec82c6c1e",
    "parameters": {
      "beta": "9/10",
      "epsilon": "0",
      "strategy_class": "independent-stationary-discounted"
    },
    "path": "C:\\Users\\scott\\GitHub\\UNIFORM\\solver-output\\stochastic-smoke\\query.smt2",
    "period": null,
    "sha256": "e9521825501b65a280c8aaa4f4d1cbd621d6ddf1c200b65260edb004872b6725"
  },
  "run": {
    "backend": "python-binding",
    "elapsed_seconds": 0.11924179999914486,
    "executable": "python:z3",
    "native_proof_sha256": null,
    "proof_available": false,
    "returncode": 0,
    "solver": "z3",
    "status": "sat",
    "timed_out": false,
    "version": "5.3.1"
  },
  "schema": "uniform.solver-artifact/v1",
  "trust_boundary": {
    "global_game_claim": false,
    "sat": "candidate until independently checked",
    "unsat": "bounded solver result; native proof is not independently checked here"
  }
}
