{
  "created_utc": "2026-10-16T23:45:07.169048+00:00",
  "model": {
    "independent_verification": "passed",
    "rational_value_count": 14,
    "unparsed_value_names": [],
    "verification_note": "exact Fraction re-evaluation of all deterministic stationary deviations"
  },
  "query": {
    "bytes": 2366,
    "claim_scope": "independent stationary profiles; all unilateral discounted deviations",
    "epsilon": "0",
    "game_sha256": "f7d8791579e2a6e82d69a011d39e2e3fc24ad7ada73bbe6020480ddd1ef8ead6",
    "parameters": {
      "beta": "1/2",
      "epsilon": "0",
      "strategy_class": "independent-stationary-discounted"
    },
    "path": "C:\\Users\\scott\\GitHub\\UNIFORM\\solver-output\\stochastic-final\\query.smt2",
    "period": null,
    "sha256": "08977bcf63422daf685a719760bdc237545a279153bcf9e2ea0a4d0579d9d904"
  },
  "run": {
    "backend": "python-binding",
    "elapsed_seconds": 0.0618971000003512,
    "executable": "python:cvc5",
    "native_proof_sha256": null,
    "proof_available": false,
    "returncode": 0,
    "solver": "cvc5",
    "status": "sat",
    "timed_out": false,
    "version": "1.4.2"
  },
  "schema": "uniform.solver-artifact/v1",
  "trust_boundary": {
    "global_game_claim": false,
    "sat": "candidate until independently checked",
    "unsat": "bounded solver result; native proof is not independently checked here"
  }
}
